{
  "schema_version": 1,
  "decision_id": "DEC-00000000-0000-0000-0000-000000000000",
  "workflow_id": "WF-00000000-0000-0000-0000-000000000000",
  "task_id": null,
  "run_id": null,
  "trigger": "IMPLEMENTATION_TRADEOFF",
  "summary": "<PLACEHOLDER: 需要用户决定的事项>",
  "options": [
    {
      "option_id": "OPTION-1",
      "description": "<PLACEHOLDER: 选项说明>",
      "impact": "<PLACEHOLDER: 对范围、成本、风险或兼容性的影响>",
      "reversibility": "unknown"
    }
  ],
  "recommended_option": null,
  "evidence_refs": [],
  "created_at": "2026-01-01T00:00:00Z",
  "status": "PENDING"
}
